{
  "$schema": "http://json-schema.org/draft-07/schema#",
  "title": "Company",
  "description": "Your business entity",
  "type": "object",
  "required": ["name", "invoice_prefix"],
  "properties": {
    "id": { "type": "string" },
    "name": { "type": "string" },
    "address1": { "type": "string" },
    "address2": { "type": "string" },
    "city": { "type": "string" },
    "state": { "type": "string" },
    "postal_code": { "type": "string" },
    "country": { "type": "string" },
    "phone": { "type": "string" },
    "email": { "type": "string", "format": "email" },
    "website": { "type": "string" },
    "logo": { "type": "string", "description": "Path to logo file" },
    "invoice_prefix": {
      "type": "string",
      "description": "Prefix for invoice numbers, e.g. JZSW"
    },
    "invoice_counter": {
      "type": "integer",
      "description": "Next invoice number to use"
    },
    "default_payment_terms": {
      "type": "integer",
      "description": "Default net days for payment, e.g. 30"
    },
    "colors": {
      "type": "object",
      "properties": {
        "primary": { "type": "string" },
        "secondary": { "type": "string" }
      }
    }
  }
}
